{
  "$schema": "./ambrosiaConfig-schema.json",
  "autoRegister": true,
  "instanceName": "INSTANCE_NAME",
  "icCraPort": 2520,
  "icReceivePort": 2020,
  "icSendPort": 2021,
  "icLogFolder": "LOG_FOLDER",
  "icBinFolder": "BIN_FOLDER",
  "useNetCore": false,
  "logTriggerSizeInMB": 256,
  "debugStartCheckpoint": 0,
  "debugTestUpgrade": false,
  "appVersion": 0,
  "activeCode": "VCurrent",
  "icLogStorageType": "Files",
  "isActiveActive": false,
  "replicaNumber": 0,
  "icHostingMode": "Integrated",
  "lbOptions": {
    "deleteLogs": false,
    "deleteRemoteCRAConnections": false,
    "outputLogDestination": "ConsoleAndFile",
    "outputLogFolder": "./outputLogs",
    "outputLoggingLevel": "Minimal",
    "allowDisplayOfRpcParams": true,
    "allowPostMethodTimeouts": true,
    "enableTypeScriptStackTraces": true,
    "messageBytePoolSizeInMB": 2,
    "maxMessageQueueSizeInMB": 64
  }
}
