{
    "$schema": "./ambrosiaConfig-schema.json",
    "autoRegister": false,
    "instanceName": "server",
    "icCraPort": 2500,
    "icReceivePort": 2000,
    "icSendPort": 2001,
    "icLogFolder": "C:/logs/",
    "icBinFolder": "",
    "useNetCore": false,
    "logTriggerSizeInMB": 1024,
    "debugStartCheckpoint": 0,
    "debugTestUpgrade": false,
    "appVersion": 0,
    "upgradeVersion": 0,
    "activeCode": "VCurrent",
    "lbOptions": 
    {
        "deleteLogs": true, 
        "deleteRemoteCRAConnections": false,
        "outputLogDestination": "ConsoleAndFile",
        "outputLogFolder": "./outputLogs",
        "outputLoggingLevel": "Verbose",
        "allowDisplayOfRpcParams": true,
        "allowPostMethodTimeouts": true,
        "enableTypeScriptStackTraces": true
    }
}