{
    "$schema": "./ambrosiaConfig-schema.json",
    "autoRegister": false,
    "instanceName": "PTIServer",
    "icCraPort": 2500,
    "icReceivePort": 2000,
    "icSendPort": 2001,
    "icLogFolder": "C:/logs/",
    "icBinFolder": "C:/src/Git/PostSledgehammer/AMBROSIA/ImmortalCoordinator/bin/x64/Release;C:/src/Git/PostSledgehammer/AMBROSIA/Ambrosia/Ambrosia/bin/x64/Release",
    "useNetCore": false,
    "logTriggerSizeInMB": 256,
    "debugStartCheckpoint": 0,
    "debugTestUpgrade": false,
    "appVersion": 0,
    "upgradeVersion": 0,
    "activeCode": "VCurrent",
    "lbOptions": 
    {
        "deleteLogs": true, 
        "deleteRemoteCRAConnections": false,
        "outputLogDestination": "ConsoleAndFile",
        "outputLogFolder": "./outputLogs",
        "outputLoggingLevel": "Minimal",
        "allowDisplayOfRpcParams": true,
        "allowPostMethodTimeouts": true,
        "enableTypeScriptStackTraces": true,
        "messageBytePoolSizeInMB": 2
    }
}